[
  {
    "blockType": "navbar",
    "moduleUrl": "blocks/navbar.a3f1c2d4.mjs",
    "integrity": "a3f1c2d4e5b60718293a4b5c6d7e8f90a1b2c3d4e5f60718293a4b5c6d7e8f90",
    "publisher": "acme",
    "publisherVerified": true,
    "definition": {
      "name": "navbar"
    }
  },
  {
    "blockType": "hero",
    "moduleUrl": "blocks/hero.0b1c2d3e.mjs",
    "integrity": "sha256-o/HC1OW2BxgpOktcbX6PkKGyw9Tl9gcYKTpLXG1+j5A=",
    "publisher": "acme",
    "publisherVerified": false,
    "definition": {
      "name": "hero"
    }
  }
]
